{
 "version": 1,
 "source": "nucleon/port-tasks @ 8004542 (BSD-2)",
 "ports": [
  {
   "dbrow": 8587,
   "name": "Port Sarim",
   "level": 1,
   "x": 3056,
   "y": 3194,
   "plane": 0,
   "board": true
  },
  {
   "dbrow": 8588,
   "name": "The Pandemonium",
   "level": 1,
   "x": 3078,
   "y": 2987,
   "plane": 0,
   "board": true
  },
  {
   "dbrow": 8589,
   "name": "Land's End",
   "level": 5,
   "x": 1511,
   "y": 3405,
   "plane": 0,
   "board": true
  },
  {
   "dbrow": 8590,
   "name": "Musa Point",
   "level": 10,
   "x": 2965,
   "y": 3146,
   "plane": 0,
   "board": true
  },
  {
   "dbrow": 8591,
   "name": "Hosidius",
   "level": 5,
   "x": 1726,
   "y": 3447,
   "plane": 0,
   "board": false
  },
  {
   "dbrow": 8593,
   "name": "Catherby",
   "level": 20,
   "x": 2796,
   "y": 3408,
   "plane": 0,
   "board": true
  },
  {
   "dbrow": 8594,
   "name": "Port Piscarilius",
   "level": 15,
   "x": 1845,
   "y": 3681,
   "plane": 0,
   "board": true
  },
  {
   "dbrow": 8595,
   "name": "Brimhaven",
   "level": 25,
   "x": 2754,
   "y": 3231,
   "plane": 0,
   "board": true
  },
  {
   "dbrow": 8596,
   "name": "Ardougne",
   "level": 28,
   "x": 2670,
   "y": 3259,
   "plane": 0,
   "board": true
  },
  {
   "dbrow": 8597,
   "name": "Port Khazard",
   "level": 30,
   "x": 2688,
   "y": 3162,
   "plane": 0,
   "board": true
  },
  {
   "dbrow": 8599,
   "name": "Entrana",
   "level": 36,
   "x": 2883,
   "y": 3336,
   "plane": 0,
   "board": false
  },
  {
   "dbrow": 8600,
   "name": "Civitas illa Fortis",
   "level": 38,
   "x": 1769,
   "y": 3144,
   "plane": 0,
   "board": true
  },
  {
   "dbrow": 8601,
   "name": "Corsair Cove",
   "level": 40,
   "x": 2586,
   "y": 2844,
   "plane": 0,
   "board": true
  },
  {
   "dbrow": 8602,
   "name": "Cairn Isle",
   "level": 42,
   "x": 2745,
   "y": 2952,
   "plane": 0,
   "board": false
  },
  {
   "dbrow": 8603,
   "name": "Sunset Coast",
   "level": 44,
   "x": 1506,
   "y": 2971,
   "plane": 0,
   "board": false
  },
  {
   "dbrow": 8604,
   "name": "The Summer Shore",
   "level": 45,
   "x": 3174,
   "y": 2367,
   "plane": 0,
   "board": true
  },
  {
   "dbrow": 8605,
   "name": "Aldarin",
   "level": 46,
   "x": 1454,
   "y": 2977,
   "plane": 0,
   "board": true
  },
  {
   "dbrow": 8606,
   "name": "Ruins of Unkah",
   "level": 48,
   "x": 3143,
   "y": 2824,
   "plane": 0,
   "board": true
  },
  {
   "dbrow": 8607,
   "name": "Void Knights' Outpost",
   "level": 50,
   "x": 2651,
   "y": 2683,
   "plane": 0,
   "board": true
  },
  {
   "dbrow": 8608,
   "name": "Port Roberts",
   "level": 50,
   "x": 1858,
   "y": 3307,
   "plane": 0,
   "board": true
  },
  {
   "dbrow": 8609,
   "name": "Red Rock",
   "level": null,
   "x": 2814,
   "y": 2510,
   "plane": 0,
   "board": true
  },
  {
   "dbrow": 8610,
   "name": "Rellekka",
   "level": 62,
   "x": 2630,
   "y": 3709,
   "plane": 0,
   "board": true
  },
  {
   "dbrow": 8611,
   "name": "Etceteria",
   "level": 65,
   "x": 2612,
   "y": 3836,
   "plane": 0,
   "board": true
  },
  {
   "dbrow": 8612,
   "name": "Port Tyras",
   "level": 66,
   "x": 2141,
   "y": 3115,
   "plane": 0,
   "board": true
  },
  {
   "dbrow": 8613,
   "name": "Deepfin Point",
   "level": 67,
   "x": 1923,
   "y": 2752,
   "plane": 0,
   "board": true
  },
  {
   "dbrow": 8614,
   "name": "Jatizso",
   "level": 68,
   "x": 2412,
   "y": 3776,
   "plane": 0,
   "board": false
  },
  {
   "dbrow": 8615,
   "name": "Neitiznot",
   "level": 68,
   "x": 2302,
   "y": 3782,
   "plane": 0,
   "board": false
  },
  {
   "dbrow": 8616,
   "name": "Prifddinas",
   "level": 70,
   "x": 2158,
   "y": 3319,
   "plane": 0,
   "board": true
  },
  {
   "dbrow": 8617,
   "name": "Piscatoris",
   "level": 75,
   "x": 2300,
   "y": 3689,
   "plane": 0,
   "board": false
  },
  {
   "dbrow": 8618,
   "name": "Lunar Isle",
   "level": 76,
   "x": 2157,
   "y": 3881,
   "plane": 0,
   "board": true
  }
 ],
 "rewards": [
  {
   "dbrow": 8664,
   "xp": 78,
   "label": "Pandemonium platebody delivery",
   "type": "courier"
  },
  {
   "dbrow": 8665,
   "xp": 155,
   "label": "Port Sarim spice delivery",
   "type": "courier"
  },
  {
   "dbrow": 8666,
   "xp": 79,
   "label": "Musa Point logs delivery",
   "type": "courier"
  },
  {
   "dbrow": 8668,
   "xp": 289,
   "label": "Catherby bait delivery",
   "type": "courier"
  },
  {
   "dbrow": 8669,
   "xp": 578,
   "label": "Port Sarim honey delivery",
   "type": "courier"
  },
  {
   "dbrow": 8670,
   "xp": 78,
   "label": "Pandemonium battleaxe delivery",
   "type": "courier"
  },
  {
   "dbrow": 8673,
   "xp": 300,
   "label": "Ardougne salamander delivery",
   "type": "courier"
  },
  {
   "dbrow": 8675,
   "xp": 353,
   "label": "Port Khazard swamp paste delivery",
   "type": "courier"
  },
  {
   "dbrow": 8676,
   "xp": 706,
   "label": "Port Sarim sword delivery",
   "type": "courier"
  },
  {
   "dbrow": 8677,
   "xp": 262,
   "label": "Brimhaven vodka delivery",
   "type": "courier"
  },
  {
   "dbrow": 8678,
   "xp": 554,
   "label": "Port Sarim delivery of nothing sinister",
   "type": "courier"
  },
  {
   "dbrow": 8679,
   "xp": 1011,
   "label": "Port Piscarilius book delivery",
   "type": "courier"
  },
  {
   "dbrow": 8680,
   "xp": 655,
   "label": "Ruin of Unkah rune delivery",
   "type": "courier"
  },
  {
   "dbrow": 8681,
   "xp": 6521,
   "label": "Rellekka pie delivery",
   "type": "courier"
  },
  {
   "dbrow": 8683,
   "xp": 78,
   "label": "Port Sarim jewellery delivery",
   "type": "courier"
  },
  {
   "dbrow": 8684,
   "xp": 155,
   "label": "Pandemonium steel delivery",
   "type": "courier"
  },
  {
   "dbrow": 8685,
   "xp": 89,
   "label": "Musa Point rotten banana delivery",
   "type": "courier"
  },
  {
   "dbrow": 8686,
   "xp": 178,
   "label": "Pandemonium rum delivery",
   "type": "courier"
  },
  {
   "dbrow": 8687,
   "xp": 300,
   "label": "Brimhaven jewellery delivery",
   "type": "courier"
  },
  {
   "dbrow": 8689,
   "xp": 78,
   "label": "Port Sarim fish delivery",
   "type": "courier"
  },
  {
   "dbrow": 8690,
   "xp": 99,
   "label": "Musa Point ship part delivery",
   "type": "courier"
  },
  {
   "dbrow": 8692,
   "xp": 296,
   "label": "Catherby grog delivery",
   "type": "courier"
  },
  {
   "dbrow": 8693,
   "xp": 592,
   "label": "Pandemonium arrowtip delivery",
   "type": "courier"
  },
  {
   "dbrow": 8696,
   "xp": 377,
   "label": "Port Khazard kyatt teeth delivery",
   "type": "courier"
  },
  {
   "dbrow": 8697,
   "xp": 755,
   "label": "Pandemonium swamp paste delivery",
   "type": "courier"
  },
  {
   "dbrow": 8698,
   "xp": 308,
   "label": "Ruin of Unkah cocktail delivery",
   "type": "courier"
  },
  {
   "dbrow": 8701,
   "xp": 331,
   "label": "Ardougne sand delivery",
   "type": "courier"
  },
  {
   "dbrow": 8702,
   "xp": 79,
   "label": "Port Sarim coconut delivery",
   "type": "courier"
  },
  {
   "dbrow": 8703,
   "xp": 158,
   "label": "Musa Point banana delivery",
   "type": "courier"
  },
  {
   "dbrow": 8704,
   "xp": 89,
   "label": "Pandemonium banana delivery",
   "type": "courier"
  },
  {
   "dbrow": 8705,
   "xp": 178,
   "label": "Musa Point eye patch delivery",
   "type": "courier"
  },
  {
   "dbrow": 8706,
   "xp": 169,
   "label": "Brimhaven rum delivery",
   "type": "courier"
  },
  {
   "dbrow": 8708,
   "xp": 88,
   "label": "Port Sarim logs delivery",
   "type": "courier"
  },
  {
   "dbrow": 8709,
   "xp": 110,
   "label": "Pandemonium rum delivery",
   "type": "courier"
  },
  {
   "dbrow": 8711,
   "xp": 193,
   "label": "Catherby coconut delivery",
   "type": "courier"
  },
  {
   "dbrow": 8718,
   "xp": 1001,
   "label": "Summer Shore banana delivery",
   "type": "courier"
  },
  {
   "dbrow": 8721,
   "xp": 289,
   "label": "Port Sarim flax delivery",
   "type": "courier"
  },
  {
   "dbrow": 8722,
   "xp": 578,
   "label": "Catherby bait delivery",
   "type": "courier"
  },
  {
   "dbrow": 8723,
   "xp": 154,
   "label": "Ardougne fish delivery",
   "type": "courier"
  },
  {
   "dbrow": 8725,
   "xp": 197,
   "label": "Port Khazard bow delivery",
   "type": "courier"
  },
  {
   "dbrow": 8726,
   "xp": 394,
   "label": "Catherby glassmaking supplies delivery",
   "type": "courier"
  },
  {
   "dbrow": 8732,
   "xp": 296,
   "label": "Pandemonium wax delivery",
   "type": "courier"
  },
  {
   "dbrow": 8733,
   "xp": 591,
   "label": "Catherby coconut delivery",
   "type": "courier"
  },
  {
   "dbrow": 8734,
   "xp": 116,
   "label": "Brimhaven fish delivery",
   "type": "courier"
  },
  {
   "dbrow": 8736,
   "xp": 206,
   "label": "Musa Point lobster delivery",
   "type": "courier"
  },
  {
   "dbrow": 8737,
   "xp": 413,
   "label": "Catherby banana delivery",
   "type": "courier"
  },
  {
   "dbrow": 8738,
   "xp": 1078,
   "label": "Port Piscarilius honey delivery",
   "type": "courier"
  },
  {
   "dbrow": 8740,
   "xp": 185,
   "label": "Musa Point cocktail delivery",
   "type": "courier"
  },
  {
   "dbrow": 8741,
   "xp": 339,
   "label": "Brimhaven fish delivery",
   "type": "courier"
  },
  {
   "dbrow": 8744,
   "xp": 720,
   "label": "Corsair Cove sword delivery",
   "type": "courier"
  },
  {
   "dbrow": 8749,
   "xp": 285,
   "label": "Pandemonium meat delivery",
   "type": "courier"
  },
  {
   "dbrow": 8750,
   "xp": 601,
   "label": "Brimhaven spice delivery",
   "type": "courier"
  },
  {
   "dbrow": 8751,
   "xp": 131,
   "label": "Catherby pineapple delivery",
   "type": "courier"
  },
  {
   "dbrow": 8752,
   "xp": 231,
   "label": "Brimhaven compost delivery",
   "type": "courier"
  },
  {
   "dbrow": 8753,
   "xp": 1597,
   "label": "Red Rock karambwan delivery",
   "type": "courier"
  },
  {
   "dbrow": 8755,
   "xp": 277,
   "label": "Port Sarim amulet delivery",
   "type": "courier"
  },
  {
   "dbrow": 8756,
   "xp": 69,
   "label": "Ardougne fish delivery",
   "type": "courier"
  },
  {
   "dbrow": 8759,
   "xp": 69,